numero,fecha,vendedor,numero_cliente,subtotal,iva,total,descripcion
1,2023-01-05,Alcides Donaire Barrena,98,19955.34,2394.6408,22349.9808,"Age drop sea try recognize police line. Like team walk act look behind the.
Control travel activity lot development prepare attorney because. Congress voice image."
2,2023-01-08,Natanael Badía Manuel,2,4018.1,482.17199999999997,4500.272,"Food feeling I minute. Everyone store miss store.
Majority bill cost term manage history. Without bank whole. Every must full reflect fish."
3,2023-01-11,Pascuala Pi Miralles,48,15162.71,1819.5251999999998,16982.2352,"Seat risk image picture must and watch. Test career crime into box. Half film real clearly direction yeah.
Generation red share."
4,2023-01-09,Eutimio Vara Bernad,39,15421.85,1850.622,17272.472,Story else like reason determine beyond gas. Sign sound large environment ever phone. Again anything western give. Article become whom job.
5,2023-01-05,Claudio Jerez Moreno,66,10145.1,1217.412,11362.512,Although could half. Health political international opportunity read decade themselves.
6,2023-01-01,Amaya Laguna Barreda,89,18300.19,2196.0227999999997,20496.212799999998,Trial ok consider recent audience. Still team generation son do within move consider. Scene too capital officer bar.
7,2023-01-08,Celestino de Clemente,77,7360.54,883.2647999999999,8243.8048,"Range pick pattern weight process family. Card PM establish include. Real budget TV ball.
Out reveal fish growth work others interesting. Capital lead course quickly."
8,2023-01-01,Borja Montenegro Casado,71,8791.29,1054.9548,9846.2448,"Attack right industry job. Nature of trouble where pattern manage.
Room that describe doctor today. Coach pressure consumer produce marriage."
9,2023-01-09,Ágata Paola Llano Manrique,30,14218.2,1706.184,15924.384,Improve television military country. Food line build summer house. Produce somebody recognize believe perhaps economic guess.
10,2023-01-06,Galo Torre Blazquez,49,5417.86,650.1432,6068.003199999999,Include return population let. Face care officer themselves such issue over. Ago job class education billion citizen last protect.
11,2023-01-13,Erasmo Samuel Fiol Navas,83,8459.43,1015.1316,9474.5616,Young tend reason late spend animal heavy report. Southern bring alone life dinner. Young first threat increase discussion.
12,2023-01-14,Jacinto Juliá Belmonte,62,4992.18,599.0616,5591.2416,Enjoy local cover a line great rich. Audience father information road support west. According help stay discuss short.
13,2023-01-11,Ileana Llano-Amador,39,6362.92,763.5504,7126.4704,"Term region rise drug alone country child.
Find similar identify less.
Deal threat successful keep point amount. Single sport bar grow be manage. Let with present TV job.
About defense study treat."
14,2023-01-04,Efraín Venceslás Yuste Tejero,74,10719.6,1286.352,12005.952000000001,"His you hour sign. Hope attack human officer change prevent.
Home once cover tonight agency coach instead. While care road picture. Dinner shoulder whether design difficult western."
15,2023-01-08,Caridad Valdés Lorenzo,24,14015.72,1681.8863999999999,15697.606399999999,"Me what style day. Anything and participant out view spring wide. President various stay official claim itself center.
Threat ability official let. Alone develop themselves second finish."
16,2023-01-07,Salomón Lobato Heras,51,16384.03,1966.0835999999997,18350.113599999997,"Fish trial sit discover create. Land human brother official hear daughter service.
School store contain skin themselves tough.
Fly station western blood. Down threat could or."
17,2023-01-05,Fabiola de Céspedes,57,12405.24,1488.6288,13893.8688,Leg once security. Laugh sit parent above. Focus late send season something at environment. Decade officer community land rate product hair.
18,2023-01-09,Soraya Gutierrez Ribera,37,13489.15,1618.6979999999999,15107.848,"Production read society raise.
Son up suddenly discuss let.
Voice perhaps model glass. We modern help fear wife. Own open rock he tonight.
Develop area require article relationship pressure player."
19,2023-01-02,Paola Modesta Puerta Ojeda,4,16266.55,1951.9859999999999,18218.536,"Real true part several born leave. Often on student usually generation three.
Drop international high. Task yeah occur option beat its. Strategy something pass house."
20,2023-01-08,Fulgencio Salinas Cañas,53,7684.15,922.098,8606.248,I recently similar million environmental TV partner. City industry once state exist look brother.
21,2023-01-06,Alexandra Ariza Nogueira,67,8993.64,1079.2368,10072.8768,Congress your learn outside someone guy trade. Then sometimes girl letter. Nice summer suffer none avoid reach.
22,2023-01-03,Florinda Barrera,68,17664.89,2119.7868,19784.6768,"Bed yes young quality order offer college hope. Himself else similar.
Leave bar third whether religious reflect western. Summer candidate as beautiful."
23,2023-01-06,Úrsula Céspedes Teruel,80,12160.76,1459.2912,13620.0512,"That once gas view. Position many now minute last.
Eat want create hospital international couple attorney."
24,2023-01-08,Luisina Amor-Ripoll,77,4862.29,583.4748,5445.7648,"Bed car store. Charge explain go part north.
Glass general four compare country trouble future. Exist professor present no."
25,2023-01-03,Tristán Iñiguez Alcalá,72,8197.83,983.7396,9181.5696,"Executive brother blue political reality.
When usually her voice drug. Image study many quickly anything program. Road member art system up. Until get result throw rest candidate form special."
26,2023-01-02,Ana Becerra Díez,90,14376.46,1725.1752,16101.635199999999,"Enter page meeting development TV. Foot trouble since employee capital exist.
Sort arm consider dream cover gun."
27,2023-01-03,Remedios Velasco Nogués,45,18548.29,2225.7948,20774.0848,"Young century interview run program.
Since catch reflect dream hit trouble. Recent piece station. Lose article candidate new second seem specific. Education carry during."
28,2023-01-14,Rosalinda del Mir,94,13700.22,1644.0264,15344.2464,Suffer whether idea practice quality open resource. Population without early second. Recognize right together agency.
29,2023-01-04,Olga Clarisa Alonso Larrañaga,30,18715.95,2245.914,20961.864,"Traditional reduce sport everybody research sell. Month sport mouth campaign night behind.
Source word guess commercial today contain lot. Between guess unit fire television six."
30,2023-01-01,Verónica Camino,89,6205.39,744.6468,6950.0368,Ten dinner forget upon without evening personal. Already economy available the give member. Today act authority whatever official statement hair.
31,2023-01-09,Arsenio Nicolau Roselló,48,8088.98,970.6775999999999,9059.657599999999,Expert into political each fact. Good speak yeah when especially organization act create. None let future can investment rich discuss rock. Recently increase you.
32,2023-01-11,Geraldo Niño Álvarez,92,17742.59,2129.1108,19871.7008,"Consumer fly old form attention apply. Carry lawyer goal present never or husband. Might individual record figure.
Simply practice strong sister total source. Simply should while."
33,2023-01-09,Amarilis Asenjo Gilabert,27,4892.43,587.0916,5479.5216,"Just member similar upon along.
Identify night player drive. Late become single spring. Myself door smile necessary. Without effort song subject protect."
34,2023-01-09,Zoraida Farré Ugarte,18,9173.42,1100.8104,10274.2304,Address particular toward in land note. Now level serve traditional yard throw.
35,2023-01-05,Almudena Valls Moliner,16,14753.23,1770.3875999999998,16523.617599999998,"Big four suddenly customer. Pressure night woman perhaps young. Whatever fish approach at gun true picture born. Establish wall world design something newspaper.
As cold huge number news society."
36,2023-01-06,Magdalena Zurita Sainz,20,12149.93,1457.9916,13607.9216,Nor several check chance sea admit. Hair until main team million determine your. Begin would yeah thought where fire outside once.
37,2023-01-11,Roldán Julio Rebollo Duque,11,18544.38,2225.3256,20769.7056,Natural realize training successful glass week shake. Last reflect writer both probably.
38,2023-01-05,Mayte Estrada Valenciano,63,6800.66,816.0791999999999,7616.7392,Kid past rich result it. Yeah program above strategy PM cause. Reveal either cover performance space. Door many and do story national.
39,2023-01-11,Venceslás Andrade Tomé,47,18820.52,2258.4624,21078.9824,"Relationship like political quickly traditional. Rate whose same none western town season great.
Let run her seek. These hundred court radio doctor. Investment evidence red some full."
40,2023-01-13,Julie Guardiola,32,9271.85,1112.622,10384.472,"Writer four sort employee road race game.
Really happen follow wind minute today Mrs. Whom I including third southern."
41,2023-01-14,Micaela del Galan,89,11976.62,1437.1944,13413.814400000001,"Question big population. Really live option buy third send wait.
Seek some program this page. Glass fill difference rate future wide easy media. Support check which room economic wrong."
42,2023-01-03,Severiano Narváez Sarmiento,97,18387.58,2206.5096000000003,20594.089600000003,"Difference agency health area.
State voice feel turn evidence red. Benefit stage issue.
Firm onto certain art floor life. Lay I company recently.
Outside perform event machine back too."
43,2023-01-11,Ruben Llorente Hierro,8,18031.67,2163.8003999999996,20195.4704,Approach of six similar religious. Soldier support growth figure station its another. Law event well mother skin thing special.
44,2023-01-12,Mar de Llanos,61,3657.21,438.8652,4096.0752,Yourself mention college across campaign college class. Pressure fire anything better set rest us. Gun hair should finish.
45,2023-01-05,Teodora Morell,21,9202.98,1104.3575999999998,10307.337599999999,"Source prepare give real hair hot ago country. Itself four town.
Commercial expert third decision. Enough safe job three. Knowledge suddenly tend student bar."
46,2023-01-01,Gabriela Saavedra Benavides,44,16598.4,1991.808,18590.208000000002,"Foot development threat child.
Thousand camera large. Benefit represent tonight painting base discussion he."
47,2023-01-06,Paco del Soto,84,5273.95,632.8739999999999,5906.824,Perhaps yes create treat. Entire necessary big theory law. Everybody plant someone relationship company get which.
48,2023-01-13,Victor Manuel Olmedo-Mir,5,14594.07,1751.2884,16345.3584,"Federal yard market argue manager appear.
Work success movement fund too far. Put step seem force bar local best. Near always war relate."
49,2023-01-12,Abigaíl Francisco Alberto,28,7075.72,849.0864,7924.8064,"Score rise friend blue. Short expert tend high product option. Third recently science process again.
Interesting the send piece world. Live service guess. Drop everybody point fall build."
50,2023-01-04,Leandra Herrera Gonzalez,43,18076.71,2169.2052,20245.9152,"Style list upon music sometimes sit spend. Happen yet enjoy notice nature American involve.
Nearly field no into old. Evidence minute feel economic."
51,2023-01-05,María Luisa Llanos-Rocamora,25,14843.44,1781.2128,16624.6528,Skill door house head force past. Culture must tend suddenly only story. First it religious discussion thus current.
52,2023-01-03,Azucena Lupita Merino Suarez,21,16474.09,1976.8908,18450.9808,"Class continue this identify body region.
South direction everything fire despite. Natural respond away information anything grow. Movement job which understand."
53,2023-01-04,Rocío Estevez Barral,24,16563.69,1987.6427999999999,18551.3328,"Green under people crime do positive quite. Sister red indeed.
They analysis step perform try audience. Investment strong officer."
54,2023-01-11,Emma Aragón Amador,7,9853.9,1182.4679999999998,11036.367999999999,"Six land different billion list along. Situation mouth market shake hotel girl.
Number age both present fund stop push. Possible common single scientist. Range car cold ever."
55,2023-01-10,Nazaret Pujadas Durán,62,19662.37,2359.4844,22021.8544,Discuss manage newspaper above central one similar tonight. Important over eye significant live. Media himself officer follow.
56,2023-01-12,Alba Gelabert Iglesias,42,10101.07,1212.1283999999998,11313.1984,"Believe piece high area school leave. Address put call recently article thousand.
Wait investment audience. She like manage they black."
57,2023-01-14,Prudencio Martí Valverde,20,14300.81,1716.0972,16016.9072,Others meeting guess rise. Admit arrive role environment firm factor. Crime education quickly can free challenge top.
58,2023-01-06,Arcelia América Salmerón Cerezo,29,6845.07,821.4083999999999,7666.4784,"No protect up executive. I should rule assume.
Opportunity step room Mr. Wonder environmental prepare between yes establish reveal reveal.
Explain partner listen lot sometimes sister. Play page try."
59,2023-01-11,Mar Luís Bueno,69,9297.76,1115.7312,10413.4912,"Card opportunity young whether bad real. Arm church table total.
Return agency strategy whose. Dinner film scene life."
60,2023-01-09,Maricela Echeverría Valenzuela,39,5514.45,661.7339999999999,6176.183999999999,"Others voice matter letter exactly certain stand.
Resource act after late. Company skill pretty increase meet them with strategy. Last enjoy task design."
61,2023-01-10,Piedad de Zurita,56,17456.04,2094.7248,19550.7648,Industry financial data next control close. Conference southern truth but figure feeling doctor. Avoid you thousand story resource his deal.
62,2023-01-12,Loreto de Múgica,15,17509.92,2101.1903999999995,19611.110399999998,Strong war change suddenly glass design. Country news tough sound receive health. Later explain pass season police throughout suffer. Baby choose guy girl around.
63,2023-01-11,Elena Peiró Benitez,12,17195.05,2063.406,19258.456,Majority low college. Yet hard subject next later speak why develop. However here suggest.
64,2023-01-03,Martin Ceferino Oller Valero,17,8911.92,1069.4304,9981.3504,"Writer carry attention help response. Sell if respond despite.
Surface would information head ask just develop indicate. Indeed dream may of letter available. Scientist word difference boy."
65,2023-01-02,Juan Luis Crespi Chaparro,80,16922.56,2030.7072,18953.267200000002,"Final remain against understand book hard. Short arm land each.
Quality outside third attention decade. Television where across war also all."
66,2023-01-11,Jessica Castrillo Miralles,22,6584.02,790.0824,7374.102400000001,"Big seven already than data. Above several air everybody agency speech economy.
Human look begin production perhaps. Sort teach bit. Trial fact true concern. Fall explain radio cup leader else voice."
67,2023-01-05,Macaria Mateu Narváez,55,14810.84,1777.3008,16588.1408,Professor cover account perhaps time citizen. Those face within knowledge. Food per Mr answer.
68,2023-01-05,Godofredo Eduardo Hernandez Pardo,42,9270.12,1112.4144000000001,10382.5344,"Finish value wide capital. Process goal thought important.
City trip what enter ahead exactly fine. Board capital lot model."
69,2023-01-11,Régulo Cornejo Robledo,83,12485.24,1498.2287999999999,13983.468799999999,Child mind meeting stand perform now officer have. At early time.
70,2023-01-14,Judith Salvador Pintor,51,11787.62,1414.5144,13202.1344,Source station often return travel. Book over others stock late alone. Moment direction eight player soldier relate carry those. Rich road role particularly again southern range interview.
71,2023-01-12,Fidela Seguí Bernad,86,7297.07,875.6483999999999,8172.7184,These part maybe social individual sound stage. Technology its life.
72,2023-01-04,Isabel Yuste Vazquez,46,14643.48,1757.2176,16400.6976,Hold shake month nearly see charge. Window so choose more us individual take. Movie debate perhaps culture prevent.
73,2023-01-07,Emigdio Alberola-Juan,52,3005.31,360.6372,3365.9472,"Discover nearly site way. Thus task image time wrong level. Every summer education computer.
Whose inside key way. Garden quite can sister."
74,2023-01-07,Joel Blazquez Maza,11,11503.9,1380.4679999999998,12884.367999999999,"Speech career water call. Opportunity image guy who.
North near responsibility last. Media support reason. Crime reveal condition worry again position fly. Water always debate leave tree participant."
75,2023-01-14,Azeneth Salinas,99,19088.92,2290.6703999999995,21379.590399999997,"Return center likely add national month. Dark share at dream bring. Prove cell tax soon they.
Those than student gun trial rather theory. Suggest kind media do financial."
76,2023-01-11,Tadeo Torres-Grande,11,18139.44,2176.7327999999998,20316.1728,"Itself travel some moment. Suggest table key those single reason.
Kind study community water. Street speak front prove.
Woman race girl investment. Ability provide statement woman million."
77,2023-01-14,Hermenegildo del Valdés,92,5150.43,618.0516,5768.4816,News apply student item summer. Church source reveal future administration everybody whom. Their difference include return provide bag.
78,2023-01-07,Edelmira Casanovas Gonzalo,1,5741.36,688.9631999999999,6430.3232,"Anyone stand conference hard foot. Certainly rest tell public wind million.
Near do Democrat positive rise executive require. Brother study first."
79,2023-01-02,Sol Duarte Barragán,79,6350.87,762.1043999999999,7112.9744,"Three camera remember house few. School enjoy letter environment important.
Everyone executive compare chance time then."
80,2023-01-02,Eligia Calvet-Garcia,26,17908.4,2149.0080000000003,20057.408000000003,"Strong own attack standard. Work especially resource.
Different director sea second kind. Item difference industry reach."
81,2023-01-05,Tadeo Sales,60,3271.68,392.60159999999996,3664.2816,"Bring nature after lawyer own three. Hope two than stage all represent.
Church few green loss usually structure land. Woman hard member say."
82,2023-01-13,Dalila Ríos Balaguer,79,17221.36,2066.5632,19287.9232,"A bring military sit college remember. Charge section interview perhaps.
Might red man structure. Rule consumer some fact. News rise us turn realize garden receive."
83,2023-01-11,Buenaventura Escrivá Barreda,87,8282.49,993.8987999999999,9276.3888,"Responsibility sport opportunity while history process other newspaper. Street eat movie save. Present course maintain or mean.
These station note check half. Receive consider fine perform."
84,2023-01-14,Prudencia Velasco,67,14726.52,1767.1824,16493.702400000002,"Really role under finally pretty. Author in difficult develop do much through fish. Study some part soon.
Plant total weight herself at become. Question exist site system quite challenge treat."
85,2023-01-02,Zoraida Zapata Galan,44,5138.45,616.6139999999999,5755.063999999999,"Candidate middle customer either stage age. Despite similar agree option within must.
Full house source suddenly. Else I radio team situation it.
Face as stand able matter trip. Music woman fear."
86,2023-01-12,Pepita Serna,9,16269.89,1952.3867999999998,18222.2768,Boy heavy indeed fear movement service join check. Stuff message at deep it.
87,2023-01-08,Ema Vicente Mesa,92,12450.95,1494.114,13945.064,"View actually else blue. Agree miss line bill system. Skill wind interest individual gun free.
On right pressure light method could. Data possible agree measure. Huge cup number just tough what."
88,2023-01-02,Flavia Máxima Cortés Expósito,7,8170.92,980.5104,9151.4304,"Evening growth interview weight happen though official.
Security four middle at together. Common energy decade both stop act this. Popular our painting campaign."
89,2023-01-03,Fabio Porras Martí,20,6834.73,820.1675999999999,7654.897599999999,"Serve color window door walk indicate seven. Goal remain between necessary involve good probably.
Think professor officer represent recent when. Lawyer part education age pretty forget try."
90,2023-01-03,Anacleto Iglesia Conesa,95,10819.11,1298.2932,12117.4032,"Like than culture show question manager most. Simple thought across language strategy.
Hope vote suffer several. Political seat matter kid tonight detail expert."
91,2023-01-13,Ciriaco Burgos Lastra,82,5357.6,642.912,6000.512000000001,Least mention box. As why ahead stage everyone hospital raise despite. Particularly drive remain fly somebody through.
92,2023-01-06,Natalio Salas Fernandez,16,4343.66,521.2392,4864.8992,"Southern young serve heart standard case. Fill own impact process approach draw.
Maybe protect affect save test bring head. While resource rather walk."
93,2023-01-06,Jennifer Manzanares,18,19339.85,2320.7819999999997,21660.631999999998,"Community part or force trial behavior. Week too art receive.
Staff mission position ever outside produce forward. Cut entire study need general. Later piece tree culture."
94,2023-01-05,Zaira Seguí,16,7726.7,927.204,8653.904,"Gas environment can. Marriage form at far east. Administration help day at up for.
Black one foot place together. Her similar several down data. Prevent reason investment us marriage us."
95,2023-01-04,Victoria de Gómez,29,6046.86,725.6231999999999,6772.4832,Glass one series keep letter. Section popular explain pressure about. Whole choose party test.
96,2023-01-06,Brunilda Amigó Gibert,5,7102.26,852.2712,7954.5312,"Huge close vote fear any scientist meeting.
Argue one onto beat.
Water wear serious remain. Should PM discover. Pattern project outside structure section discuss great."
97,2023-01-03,Mohamed Andrade Barriga,57,12172.21,1460.6652,13632.875199999999,Sea respond blue great big. Blood act more any. Here so son forget card future. Exist half offer my political.
98,2023-01-05,Adán Roig Barrios,32,14315.13,1717.8156,16032.9456,"Owner according situation material large little radio. Seven increase carry anything whole bank hospital.
Mention make country station guy. Assume ever put top get source."
99,2023-01-07,Liliana Ibañez-Hernandez,43,16398.96,1967.8751999999997,18366.835199999998,"Wish care increase easy fast partner. Surface challenge author address. Civil sing blood system event social.
Law page camera. Remember laugh community entire agree might age."
100,2023-01-11,Alba Infante,91,6537.77,784.5324,7322.3024000000005,"Leader event hotel term father this. Itself heart technology type money although.
Energy put reach common. Street town kind group."
101,2023-01-01,Primitivo Pou Rueda,58,8111.95,973.434,9085.384,"Enjoy become scientist section source difference shoulder. Imagine maybe million. Meet environmental under situation.
Glass read management design born. Goal explain back."
102,2023-01-04,Óscar Anacleto Montserrat Luz,50,18107.02,2172.8424,20279.8624,"Music finally part rather discover. Strategy dinner indicate question military several.
Bar anyone while election."
103,2023-01-02,Mohamed Pou Sureda,34,12421.66,1490.5991999999999,13912.2592,Matter available you fish media. Special quality them card dog.
104,2023-01-03,Roxana Torrens Mendizábal,33,4406.92,528.8303999999999,4935.7504,Build off personal professional need action score. Environmental data training agree present human. His national minute hand worker.
105,2023-01-03,Teodosio Héctor Roldán Martín,62,3356.49,402.77879999999993,3759.2688,"Must rise I national state finish. Operation arrive way agency quality.
Natural hold government. Task wall have themselves. Upon nearly call your."
106,2023-01-03,Eligio Aarón Llopis Martín,1,7087.13,850.4556,7937.5856,"Room pull miss growth best. Stage list argue remember site.
Set fly could whose. Right all drug newspaper thing arm. Window which health lot maintain page blue."
107,2023-01-14,Natanael Tamayo Gabaldón,54,19174.66,2300.9592,21475.6192,"Any source guy technology image example blue. Suffer agreement can their condition strong board.
Eat accept sport charge choose despite specific. Down buy line head much."
108,2023-01-08,Luisa Sáenz Martinez,7,8438.82,1012.6583999999999,9451.4784,"Share miss personal will. Good plant check kid detail kid someone.
Total later physical road. Operation actually society conference discussion book."
109,2023-01-01,Olalla Cruz Hervás,62,18875.79,2265.0948,21140.8848,Total language word. Everything game increase reason. Respond as series music quite mother.
110,2023-01-12,Cirino Epifanio Menéndez Bartolomé,73,5976.85,717.222,6694.072,So simply after example never individual thus fear. Part film bring son. Institution letter happen few order join alone.
111,2023-01-09,Reyes Mireia Alberola Batalla,50,6795.22,815.4264,7610.6464000000005,Direction high should receive crime wait. Series floor fight in red list pretty hour. Career newspaper third why daughter something. Receive political house culture ever worker offer return.
112,2023-01-12,Pili Jara Montaña,93,4218.77,506.2524,4725.022400000001,"Rate clearly lead seven thus. Item any right range. Like police early per.
I bank bill need them join. Dog on purpose around through project. Would knowledge across."
113,2023-01-08,Mario Amorós Bilbao,81,13157.83,1578.9396,14736.7696,"Probably peace card question major. She perhaps rather air hot form. Kind rate finally race ability.
Nearly keep his operation new stay center."
114,2023-01-13,Isidro Navas,83,3527.49,423.29879999999997,3950.7888,"Others increase spend including. Arm fill gas local fear respond.
Law author evening whether member success. Themselves keep age name age experience continue. Central pretty key ever research none."
115,2023-01-06,Gervasio Torrijos Mascaró,1,14096.76,1691.6112,15788.3712,"Fine national rise soldier hold send. Young clear art where body offer out visit. Wind amount blood.
Her seem focus be art. Talk customer business. If cost western why modern personal tough."
116,2023-01-06,Catalina Zabala,9,15136.48,1816.3775999999998,16952.8576,"Movement behavior ask. Exactly indicate growth effort heart scientist.
Line director social house.
Risk will to claim increase deal movement. Song financial down two. Exist address list."
