numero,fecha,vendedor,numero_cliente,subtotal,iva,total,descripcion
117,2023-01-07,Concha Navarrete Tomás,59,7605.64,912.6768,8518.3168,"Hundred what food between consider maintain. Sister minute wrong compare others close coach.
Move talk then together."
118,2023-01-13,Edmundo Calderon Cepeda,58,3336.12,400.33439999999996,3736.4543999999996,"Happy partner room final perform five nothing shake. Wind together spend water us. Ask marriage court person.
Tend government receive girl. Hotel toward hold."
119,2023-01-13,Amor Lladó-Buendía,7,10580.77,1269.6924,11850.4624,"Eye card simple low church organization oil. Institution thus nation.
Nature determine beat car police party."
120,2023-01-05,Luna Suarez Garrido,84,11905.95,1428.714,13334.664,Purpose fine it kid. Step ask up less discover treat. Last glass writer environmental.
121,2023-01-13,Alondra Cases-Escamilla,51,11441.46,1372.9751999999999,12814.4352,Edge American region real relationship thing eye avoid. Glass ball five unit network send across. Discover ask gun reduce evidence. Stage so significant shake pressure.
122,2023-01-05,Lola Pou Pérez,36,18817.55,2258.1059999999998,21075.656,Success beautiful attorney any finish professional air. Generation tell difference campaign candidate throughout wonder. Hear adult difference yard still arrive trouble item.
123,2023-01-03,Amador Américo Martín Rebollo,10,6716.55,805.986,7522.536,"Simply smile who country ability around. Box security land early want somebody.
Meet summer stop answer air perhaps. Spend use determine by off tough probably. Well rise issue."
124,2023-01-01,Emelina Piñeiro Montenegro,58,9544.62,1145.3544,10689.974400000001,"Dinner ahead bad perhaps reflect sign law worry. Avoid fight agree use. Eye now feeling peace miss near hope.
Series ground drop democratic method participant. National fine student result simply."
125,2023-01-09,Amancio Briones Ortiz,3,9693.42,1163.2104,10856.6304,Remember ago third position plant on day. Example sort very born artist sport enter. Whether form area nor plant media.
126,2023-01-09,Encarna Delgado Salmerón,47,9623.84,1154.8608,10778.7008,"Happy none whose produce walk. Other if argue minute sign. Behavior I nor the.
Game whom by billion bill east be. Whose prove model town small. Traditional effort charge technology protect fact."
127,2023-01-13,Segismundo Diez Pablo,77,4801.2,576.144,5377.344,"Contain particular fire mind yet. Story person available question job professional. Hear newspaper itself deal.
Hot line able. Where direction may group cold. Can system always common history this."
128,2023-01-13,Cipriano Narváez Angulo,22,15223.64,1826.8367999999998,17050.4768,"Them body series her. And such they study. Action conference that thing whom we TV.
Point dark military establish sign. Myself direction once according. Ago visit right movement computer according."
129,2023-01-11,Bernarda Miró-Arranz,47,12696.55,1523.5859999999998,14220.135999999999,Left physical police put recent activity likely. Attention decade meet difference race movement.
130,2023-01-06,Marianela Isern Tomás,69,6838.17,820.5803999999999,7658.7504,Decide left theory either field. Think seven arrive message scientist piece although. Phone year major better hope including.
131,2023-01-07,Severino Duque Acero,78,16554.31,1986.5172,18540.8272,Participant recently other hotel employee development yourself check. Guy drug serious foot power marriage I. Race say real race teach. Fire political program hospital change.
132,2023-01-11,Plinio del Arranz,32,4181.6,501.79200000000003,4683.392000000001,"Which treatment time policy local possible. Color nice soon five specific air still.
Rich system make sister. Remember quite although deep radio born according."
133,2023-01-07,Rosa Sales Oliveras,21,15554.11,1866.4932,17420.6032,"Ever child stage firm quickly page Congress. Nature big magazine. Will say old affect.
Represent space necessary property.
Above tree article represent draw. Last scene range still."
134,2023-01-10,Lorenzo Sola Prieto,80,3409.58,409.14959999999996,3818.7295999999997,Member start which six baby mean. Page color agent able art must subject simply. Plan hold huge TV challenge.
135,2023-01-13,Armida del Acevedo,26,14555.93,1746.7115999999999,16302.6416,"Three open food rise. Listen four week author. Line culture anyone population.
Player base well become cell. Political check politics still recently."
136,2023-01-06,Jimena Cañizares Vaquero,26,7881.8,945.816,8827.616,"Eye only culture end court group language. Line laugh road significant bad image.
Data happy wife network back. Citizen similar seek exist."
137,2023-01-03,Gerardo Tapia,6,11249.44,1349.9328,12599.372800000001,Sign once beat event amount. Cell possible easy happen modern whose prevent. Unit community beautiful their outside.
138,2023-01-07,Amelia Linares Calatayud,65,19706.08,2364.7296,22070.8096,"Special guy Congress coach.
Price suffer here wide. Laugh adult beautiful say situation and adult although. Base gas go stage."
139,2023-01-03,Andrés Chucho Carrillo López,43,4227.91,507.34919999999994,4735.2591999999995,"Share say factor pass own still. Win truth view make number care head.
Value address turn what. Group series focus. Suffer perhaps arrive Republican family local that."
140,2023-01-04,Custodio Gracia Pol,6,4367.18,524.0616,4891.2416,"Necessary bill pay item lead rise necessary. Woman each Democrat trial result customer often.
Whose decide thought television fill box agreement. Opportunity wide per sit."
141,2023-01-09,Felipa Ferrándiz Adadia,88,18156.15,2178.7380000000003,20334.888000000003,"Bad step letter plant fast get. His imagine fund.
Plant age section research. Bar space must.
After right international past sea matter experience."
142,2023-01-10,Eladio Baró Lumbreras,67,13249.99,1589.9987999999998,14839.9888,"Turn money north glass produce by. Board both happy couple culture never he. Move Mr their trial.
Chair so politics. Drop international big despite grow writer person."
143,2023-01-07,Fernando Julián Cases,44,10349.02,1241.8824,11590.9024,"Really different develop clear land. Program last impact role enter.
Tax suddenly agree husband minute heavy job. Goal food fire white international. Those risk thing coach site leg task."
144,2023-01-11,Nacio del Heras,51,16233.79,1948.0548000000001,18181.844800000003,Point response head design. Mother beyond sure learn follow civil some. Attack become might think. Most surface summer old your.
145,2023-01-03,Marina de Alemán,40,12593.49,1511.2187999999999,14104.7088,"Relationship president system listen power southern travel. Hear task meet certain.
Cultural think whether. Week five five cultural. Use interview positive relate enough."
146,2023-01-14,Pascual Leon Valenzuela,36,12046.2,1445.544,13491.744,Head from do sort bill firm. Air paper who cut piece easy. Also chance brother drop interesting song glass visit.
147,2023-01-14,Ámbar Baquero Cortina,35,13504.86,1620.5832,15125.443200000002,"It still sing important certainly clear. Time look practice able without.
Guy wear traditional window deep. Thought short their. Reduce firm our watch right."
148,2023-01-10,José Oliver Llopis,34,5629.9,675.588,6305.487999999999,"Couple recent identify type size. Defense nearly pretty fish accept thank close throw. He have statement trial tree.
Drug dog section security particularly discuss my."
149,2023-01-11,Antonio Lopez-Ochoa,52,12151.28,1458.1536,13609.4336,"Professor box sound season wait prepare car. At age their food. Six baby attack attorney air.
Police and natural difference. Fine rock build rather. Image maybe draw huge."
150,2023-01-04,Moisés Rivero Cervantes,89,9947.2,1193.664,11140.864000000001,"Family model way late age activity however. Eye student well. Phone peace now system third particularly fish.
Market serious daughter. Behind every almost television blue."
151,2023-01-13,Onofre Sans Barceló,53,7719.66,926.3592,8646.0192,Put not for box student father remember. Power reach type eye agreement every seat. Baby government Mr wait. Subject stand option father laugh special data.
152,2023-01-07,Custodio Dalmau Donoso,86,12003.52,1440.4224,13443.9424,State thus they reason popular. Respond game defense PM. Turn treatment enjoy charge.
153,2023-01-14,Juanito de Cabo,19,8057.04,966.8448,9023.8848,"Power total though also month. Play very writer political skin. Generation example ground already.
Seat third begin pull see federal camera."
154,2023-01-09,Leoncio del Porras,25,12826.44,1539.1728,14365.6128,Style another simple choose industry two take. Spring baby property stand happen range. Debate without relate personal it personal benefit student.
155,2023-01-01,Alicia Huerta Bárcena,45,12438.23,1492.5875999999998,13930.817599999998,"Wrong answer film themselves reduce court worker. Air room particular military find see.
Down while tonight effect hour.
Form ago remember ever. Student notice course."
156,2023-01-01,Xavier Carbó Iniesta,91,5515.11,661.8131999999999,6176.923199999999,"Local much really car kitchen government plant actually. Maybe do administration source.
Perhaps catch speech away. Stay already happy relate."
157,2023-01-10,Fabio Iborra Carreño,78,10246.45,1229.574,11476.024000000001,"Keep scientist develop billion. Gas edge school spring team lay magazine.
Eat he along despite rule. Environmental growth company cultural media institution economy."
158,2023-01-09,Timoteo de Elorza,93,16493.01,1979.1611999999998,18472.171199999997,Although administration foot color boy it. Two detail picture total talk class. Pretty month order wrong.
159,2023-01-14,Pepe Bernat Giralt,81,3089.97,370.79639999999995,3460.7663999999995,"Approach sit former class return walk participant enjoy. Affect seven low particular notice partner.
Short eight direction know black. Series until south which third."
160,2023-01-13,Cruz Frías Luz,32,3419.7,410.364,3830.064,Magazine still analysis when building scene girl. Property improve town. Participant heavy describe tough word strong attorney.
161,2023-01-01,Ulises Español Sanz,51,13447.83,1613.7395999999999,15061.569599999999,"Address network until bill detail technology medical.
To somebody modern coach their. Maintain response support. End allow political affect thought guy."
162,2023-01-03,Octavio Gimenez Lucas,39,16085.68,1930.2816,18015.9616,"Particular some civil woman color forget. Ask talk condition fund.
Change they campaign relate man. Threat nation fast free group early. Open agent type positive evening."
163,2023-01-13,Rodolfo Bruno Quevedo Botella,57,3374.0,404.88,3778.88,Scientist land continue free apply sure. Program rich interesting through. Nor actually capital use.
164,2023-01-14,Flavio Pascual Mur,39,11017.8,1322.136,12339.936,Technology political key people. Itself such daughter picture record enter tell. Tough several expert fly can live. Should itself tell director.
165,2023-01-12,Lola Sosa Puig,62,12472.22,1496.6663999999998,13968.8864,"Billion offer personal pass management. Tv ask that nice door music.
Professional start main it president structure mean decide."
166,2023-01-06,Elena de Belda,22,17697.86,2123.7432,19821.6032,"Hundred others somebody wrong seven whole maybe. Win truth we TV.
Find be chair action. Address significant performance.
Rule cost share understand. Fire meeting sister car."
167,2023-01-06,Griselda Guzman Fortuny,80,14891.31,1786.9571999999998,16678.2672,"Decade onto drug get learn where.
Store art worry boy. I nor law score anyone peace red. Hour instead most when difference."
168,2023-01-13,Ana Sofía Valentín Quirós,21,5385.05,646.206,6031.256,"Cut learn beyond campaign. International budget same reflect. Fall total guess build deep.
Pick hand sure become traditional condition business. Discover strategy kitchen buy."
169,2023-01-09,Toño Vidal,43,10352.7,1242.324,11595.024000000001,"Financial particularly accept a.
Like direction environmental evening pressure claim light. Election financial series or child."
170,2023-01-04,Gisela del Gómez,32,13578.61,1629.4332,15208.0432,Him decide than I. Pattern design strong tell window maybe.
171,2023-01-12,Sabina Reig,80,5846.23,701.5475999999999,6547.777599999999,"Peace doctor great guy show north. Tonight last performance cup out.
He true write ahead. Sing forward paper from. Hand focus play through western course."
172,2023-01-14,Catalina Chaparro Saura,45,6250.48,750.0575999999999,7000.5376,"Quality share your radio fly mouth unit describe. Executive wife nature upon.
You why forget south bed nice. Listen their remember wide dog eye else. Past television particular even compare two."
173,2023-01-10,Renata Bayo Amorós,12,4344.14,521.2968000000001,4865.4368,Simple research of after world these. Reach picture scientist never sure. Of culture thing relate air.
174,2023-01-09,Rolando Cobo Benavent,98,14670.92,1760.5104,16431.4304,"Risk gas forget nor choose. College report window music. Remain traditional movement require lot card.
Much development style fast. Value writer authority girl conference you."
175,2023-01-01,Esmeralda Bermúdez Muro,6,12118.19,1454.1828,13572.372800000001,Opportunity what political sit away mention policy skill. Radio feel trouble I drop other dark.
176,2023-01-07,Oriana Molina Rubio,11,18968.46,2276.2151999999996,21244.675199999998,Concern arrive loss information participant daughter central. Approach itself maintain oil know. Capital let set event.
177,2023-01-09,Micaela Montserrat Costa Olmo,82,17163.68,2059.6416,19223.3216,"Moment discover agree small. Might south indicate. Sell budget mouth suddenly five admit.
Anything hospital lawyer speech believe meet west. Back anyone a wait one computer best."
178,2023-01-07,Genoveva Cuevas-Correa,52,4423.56,530.8272000000001,4954.3872,Phone weight this him various drug somebody. Expert this product there strong too. Notice two member number.
179,2023-01-14,Leocadia Céspedes Jove,43,8703.31,1044.3971999999999,9747.707199999999,"Education true total color fly think level. Already assume game value paper summer sit. Resource safe station sure.
Billion adult light for add. Its guess ten unit sea money."
180,2023-01-13,Fermín Salas,64,8693.86,1043.2632,9737.1232,"Provide consumer general you similar consumer me. Treatment stay seem. Morning occur choose hair option seat.
Customer everything that a red. Baby treat along simple."
181,2023-01-03,Vera Barranco Hierro,33,12873.48,1544.8175999999999,14418.2976,Situation such she maybe four center. Find stand start radio. Writer various anyone attention television listen I.
182,2023-01-12,Benigna Aguado Requena,88,11190.25,1342.83,12533.08,"Nearly by there term poor test.
Provide all party animal imagine. Generation way push mouth reflect smile. Idea represent until it station hour interesting."
183,2023-01-05,Calixto Azorin-Company,58,3118.72,374.24639999999994,3492.9664,Student prevent anything. Network imagine line. Movie personal for always since minute. Music well develop their.
184,2023-01-02,Emiliano Luna Herranz,9,19534.66,2344.1592,21878.819199999998,"Foot respond push. Option sport raise necessary minute site institution.
Either shoulder score concern size surface. Available head gas century us real. Stand size development research."
185,2023-01-08,Ezequiel Domingo Santamaria,41,12032.64,1443.9168,13476.556799999998,"Public brother half join ask fly. Rest wrong Mr condition.
Material yeah worker throughout cultural oil others.
Available current on green amount. Current free structure their later account old."
186,2023-01-06,Encarnita Pou Taboada,80,12902.49,1548.2988,14450.7888,Choose development item involve similar study difference. Participant shake form maybe activity morning son. Environment discussion expect thus laugh course appear.
187,2023-01-01,Ale Ribas Mancebo,78,3361.9,403.428,3765.328,"Than lead executive thousand style performance bag arrive. Institution single fight officer modern.
I knowledge style civil. Challenge entire month fish."
188,2023-01-14,Celso Paz Nicolau,79,8441.75,1013.01,9454.76,However example herself two spring. Nothing as to physical long care rate. Particular investment think understand condition treatment family.
189,2023-01-05,Eutimio Rivera Ramos,82,14810.96,1777.3151999999998,16588.2752,"Buy carry research might Mr. Military myself others sort. Face new care suddenly with risk fish.
Anything option present popular term professional. Fish whose forget fly about civil wind."
190,2023-01-02,Prudencia Álvaro Salamanca,11,6104.19,732.5028,6836.6928,"Benefit heavy American point send team anyone rock. Whose size happy evidence society adult always president.
Game media per team cell. Movement place approach magazine against community six."
191,2023-01-02,Cristina del Vaquero,55,6960.83,835.2995999999999,7796.1296,Fill song benefit despite able answer TV quickly. Medical research later expect ready mission. Smile attorney process pay your mother.
192,2023-01-03,Albert Gelabert Vazquez,18,6486.42,778.3704,7264.7904,Guy past station policy rest debate career. Decide personal star modern view report. Clearly push card those although.
193,2023-01-09,Luís Ernesto Goñi Ayuso,90,3683.63,442.0356,4125.6656,"Yourself share board. Sport animal hard food wonder likely wrong.
Long note shake. Newspaper environment opportunity machine now."
194,2023-01-07,Rosario Nieves Galván Acosta,92,15224.23,1826.9075999999998,17051.1376,"Then again during special air. Question probably parent history their pick too. Tell policy nation president produce player.
International born year behavior town. Yet what charge agent action."
195,2023-01-01,Guiomar Pombo Cervera,74,5169.72,620.3664,5790.0864,"Music floor send station. Successful evening rest future security where now food.
Worry according direction age truth."
196,2023-01-10,Carlos Milla Gallego,42,9090.96,1090.9152,10181.875199999999,"Through cell add large. Wind happy candidate his on case gas matter.
Magazine party agent science letter. Your mean certainly there street question still."
197,2023-01-04,Silvia de Artigas,14,7073.25,848.79,7922.04,Society science against. Management challenge choose visit can rich. Coach ahead land break firm charge cost price.
198,2023-01-11,Quique Sales Gonzalo,68,18282.05,2193.846,20475.896,"True government they would help full huge ability. Method management where responsibility end in.
Order third budget election season quality. Nice doctor himself both wonder east cold common."
199,2023-01-05,Marco Cerro Mata,77,15909.47,1909.1363999999999,17818.6064,Whatever better sport machine measure during issue each. Continue back bill thing common best early. Assume nation too during western defense.
200,2023-01-12,Josué del Herrera,98,10535.83,1264.2996,11800.1296,"Concern foot upon whom way idea. Baby hear still expect might high protect.
Medical north group reduce support when make hard. Five a door thus outside."
201,2023-01-12,Ariel Abella Corominas,12,18146.29,2177.5548,20323.8448,Material step American measure tend available. Eight opportunity teacher out plant spend. Remain participant house wife eight.
202,2023-01-02,Lorenza del Aguiló,34,3525.11,423.0132,3948.1232,Million build example claim support. Simple range threat everything who heavy will. Age new people reach down choose carry.
203,2023-01-14,Virginia Pol-Sastre,77,8274.61,992.9532,9267.5632,Ok scientist adult guy summer provide finally time. Build war great size fine executive. There public arm result run military without professional. Life experience book above.
204,2023-01-05,Perlita Valverde Corral,11,5030.71,603.6852,5634.3952,"To level then arm dinner.
Culture boy himself he simply set recognize. Guess offer soon something. Street wear woman your TV degree particularly apply."
205,2023-01-08,Paula del Cueto,49,3272.02,392.6424,3664.6624,Trial politics too camera defense lay. Six people series group time. Democrat teacher lawyer member member against foreign.
206,2023-01-12,Leonel Ribes,12,4991.32,598.9584,5590.278399999999,Beautiful set since later step rule law. Girl wife interest culture issue improve. He wish protect speech.
207,2023-01-10,Jacobo Vidal Montaña,56,12590.57,1510.8683999999998,14101.4384,"Age open may usually almost. The well indeed. Could civil drug memory.
Point believe attorney mother leg write federal. Road two head hold.
Coach very threat camera. Water computer air stock."
208,2023-01-01,Maura Gual,28,8462.19,1015.4628,9477.6528,"Activity early democratic upon attack real. Military unit sport for beyond.
Sometimes involve administration serve there than others. List beat third Democrat unit."
209,2023-01-13,Segismundo Alemán Saez,62,9872.79,1184.7348,11057.524800000001,"Because general television program me. Effect gun crime base agent. Character exist reality member bag huge bill.
Whether he sea. Worry three ahead year. Simple people drive head."
210,2023-01-02,Clementina Sandoval,57,13211.84,1585.4207999999999,14797.2608,Feeling school my pretty nearly. Coach no available shake. After continue away put try. Yard television record former direction himself rate.
211,2023-01-14,Nicolasa Candelaria Carretero Carrión,56,8188.06,982.5672,9170.6272,Clear us know far. Professional people employee piece. Skin way off citizen budget send of.
212,2023-01-04,Samuel Roldán Piquer,16,9366.53,1123.9836,10490.5136,"Of buy especially upon word interest.
Management indicate bed green strategy each. Well can position week."
213,2023-01-02,Dominga Morillo Quesada,67,11676.09,1401.1308,13077.2208,"Include risk message various large.
Out whether born most whether. Example any discussion over. Music themselves there over grow win so task.
Travel pass begin game him north."
214,2023-01-02,Bárbara del Tello,73,11479.15,1377.4979999999998,12856.648,Toward single daughter ground place effort create. President may education body reason.
215,2023-01-02,Virgilio Corbacho Neira,17,16190.85,1942.902,18133.752,"Leg hundred radio middle still support. Throw lot ten court.
Arrive risk shake cost type pass. Pay language writer need make. Paper majority official right safe. Stage personal expert watch."
216,2023-01-10,Andrea Gisbert Ferrán,61,7066.35,847.962,7914.312,"Candidate address fly community.
Floor traditional argue detail door. Bag soldier begin thing big heart peace. Such model that offer me seem management practice."
217,2023-01-09,Jose Luis Sureda Garrido,45,12754.7,1530.564,14285.264000000001,"Ready mission those I. Actually growth life fight though writer middle. Final half share.
Order agreement around student accept like center. Third onto concern hour. Effort discover those next set."
218,2023-01-11,Asdrubal Valle Riba,33,9197.33,1103.6796,10301.0096,"Current region talk. Blood piece western natural occur. Much although everybody seat research.
Per federal religious support buy case. Ready measure mission least. Floor no however seat hit tell."
219,2023-01-02,Esther Orozco Gimenez,13,13953.62,1674.4344,15628.0544,Itself include both agency watch good account. Of wear as by discuss discover air. Court bit despite reason officer majority.
220,2023-01-02,Fabricio Salgado Barberá,98,6330.8,759.696,7090.496,"Foreign rate often. Person future we campaign some.
Popular recently history determine form why probably child. Future matter quite. Effort not fight build."
221,2023-01-02,Javiera Cabrero Calvet,37,17742.68,2129.1216,19871.8016,Crime first again race travel. Yourself fund plan star toward among. Economic girl someone very lawyer image.
222,2023-01-04,Manuel Bou Gaya,77,17173.07,2060.7684,19233.8384,"Tough participant too.
Ask few mention same order member. Key full outside building red easy realize.
Study at own test better."
223,2023-01-12,Mirta Soledad Ballesteros Boada,78,17980.04,2157.6048,20137.644800000002,"Prove he human big. Detail just although yard low sing.
Sign last paper. Appear near majority set under. Manage American fish place election entire."
224,2023-01-14,Calixto Garcia,76,11013.51,1321.6212,12335.1312,"Foot read Mr. Nearly stuff much upon sometimes. Adult political former mother career back. Buy commercial moment record.
Art TV ok keep. Worry no five."
225,2023-01-13,Chema Uribe Cáceres,32,19631.83,2355.8196000000003,21987.6496,"Senior benefit not bag memory modern sea. Cultural under listen travel official control. Imagine reason to population perform page sense.
Back they see election. Out pull they never."
226,2023-01-14,Chita Álvaro Serna,6,3581.73,429.8076,4011.5376,"Seven fly represent leader difficult need house.
People help check begin population. Open wear woman data entire. Receive present style suggest state hair after."
227,2023-01-05,Carolina Ureña Cuadrado,98,13269.6,1592.352,14861.952000000001,Medical environment fact never even rate. Compare adult art carry.
228,2023-01-05,Begoña Bas,52,16372.11,1964.6532,18336.7632,"Strategy everyone sea during. Consider economic consider test already third man.
Need determine mind wish. Up section practice run safe."
229,2023-01-13,Elías Vidal Gallart,69,18425.67,2211.0804,20636.750399999997,"No price effect piece already minute. Store itself line such. Though out their ok.
Arrive need remain next describe tell develop necessary."
230,2023-01-01,Raimundo Osuna Rosa,44,8677.59,1041.3108,9718.9008,Worker use wear television and dream billion. At cultural consumer suffer woman. Then listen simply image window once present ahead.
231,2023-01-14,Noemí Medina Silva,51,13328.77,1599.4524,14928.2224,Carry fish bag hotel paper. Kind condition religious us outside their fight talk. Increase production conference worry adult foreign.
232,2023-01-06,Che Villalobos-Sanabria,76,8897.32,1067.6784,9964.9984,Experience up bank new. Statement front action case toward during apply.
233,2023-01-07,Germán Mate Peña,94,8194.74,983.3688,9178.1088,"Build door build party better. Image summer two seven guess practice remain.
Guy cup agreement. Win model camera your vote. Keep huge man. Office once relationship fill paper."
