numero,fecha,vendedor,numero_cliente,subtotal,iva,total,descripcion
234,2023-01-01,Alba Llorente Barral,75,17045.24,2045.4288000000001,19090.668800000003,"Plant model use agency out lose study. Area generation face explain morning executive action. Life heavy establish.
Within gas choice skin. Green house try individual series argue."
235,2023-01-13,Gisela Larrea,43,6095.66,731.4792,6827.1392,"Garden I adult tell. Bar purpose defense brother last treat art. Add final church edge past anything then identify.
Model only daughter together. Human low than Democrat. Drive away according place."
236,2023-01-09,Yago Cabello-Huguet,26,15765.95,1891.914,17657.864,Age view myself treatment law worry. Lead would picture tend.
237,2023-01-14,Roque Galán Arellano,63,7554.46,906.5351999999999,8460.9952,"Watch moment camera building decision. Affect describe year you too or. For woman project actually message manage material nation.
Up company moment. Key nation street court president."
238,2023-01-05,Bruno Cañizares,64,5501.8,660.216,6162.0160000000005,Eat oil anything light sit. Team father head laugh west never. Election able each center economy standard civil.
239,2023-01-01,Jonatan Godoy Barba,69,7411.46,889.3752,8300.8352,"Edge idea add.
Reason wonder catch stand stage according color quality. Anything sound represent. Maybe behind cause contain many.
Senior trade strategy head turn quality economy."
240,2023-01-08,Basilio Sáez,88,12981.34,1557.7608,14539.1008,Capital turn difference us population toward involve. Organization even customer network water.
241,2023-01-14,Duilio Cabrero Suarez,94,17872.92,2144.7504,20017.6704,"There sort head assume. Newspaper manager forget rise then board easy.
Six so power phone concern stock cut. Rest place anything computer idea tonight information listen. Heart effort plan away."
242,2023-01-12,Fermín Arcos Díaz,16,14333.06,1719.9671999999998,16053.027199999999,"Way project reflect others action method represent. Politics computer design treatment perhaps sell. Common together choose minute bed.
Sit finally by decide finally Democrat."
243,2023-01-02,Lope Pou Aranda,19,19458.85,2335.062,21793.911999999997,"Join fast owner lead arm describe fast. Life food production a history life finish item. As surface task free brother rich high.
Begin decide either alone daughter paper rise."
244,2023-01-07,Fanny Bernarda Segarra Carnero,94,6105.1,732.612,6837.712,"Letter everybody program politics best you that. Catch rise thousand good.
Industry others certain energy recently change."
245,2023-01-01,Cándido Serna,70,9968.19,1196.1828,11164.372800000001,"Born range weight information window point. Center serious price build spring politics.
Drive Congress medical. Save firm during anyone raise win deep. Seat from list."
246,2023-01-04,Lorenza Infante Cabrera,10,8644.73,1037.3675999999998,9682.0976,"Be enjoy language interesting. Yeah focus soldier discover.
Approach one tax. Many task purpose few themselves painting weight. Voice color nearly those thing trouble."
247,2023-01-06,Anacleto Iñiguez Alarcón,99,11508.62,1381.0344,12889.654400000001,"Admit all indeed table avoid improve bank. So company than then still agent soldier responsibility.
Beat official anyone mind. Agent myself meet onto year admit. Consumer four enter begin."
248,2023-01-04,Benigno Felix Echevarría Alfaro,85,13943.63,1673.2355999999997,15616.8656,Prove at team already budget nation. Least sure traditional expect realize than share father. Likely central account hear whose military. Authority sign main development edge per policy.
249,2023-01-05,Cintia Lledó González,6,11605.1,1392.612,12997.712,Road movement PM which machine marriage. Smile focus probably. With impact anything use cut. Table early live lawyer trial another significant public.
250,2023-01-10,Miguel de Delgado,39,16888.17,2026.5803999999998,18914.750399999997,"Stop simply key push. President nearly kitchen purpose very behavior suffer.
Next page by thing probably season. Reason wall agreement simple bank."
251,2023-01-14,Felix Cal Pablo,70,15355.88,1842.7055999999998,17198.5856,"Young seem white else exactly. Style treatment option five throw site.
Goal at hotel during. Evening raise six."
252,2023-01-04,Rosendo Roig Peláez,70,10435.63,1252.2756,11687.905599999998,"Time western show his unit despite. Authority water of special study. In performance tell city. Citizen work rise.
Yet save final bank. She she fish break perhaps agency. Set study last lawyer back."
253,2023-01-13,Amado Amat,65,15445.85,1853.502,17299.352,"Along lawyer bill true anything stage law our. History join opportunity assume.
Indicate real although mean. Paper item build everything film party. Again international group."
254,2023-01-06,Rómulo Montesinos Burgos,48,14551.29,1746.1548,16297.444800000001,"My rather that case center government. Apply explain trip hour personal college oil send.
Prove stage hard history. Whole pretty wind sport time part appear talk. Pm yes issue."
255,2023-01-11,Reyes Rios Montserrat,16,13966.36,1675.9632,15642.3232,"Amount sing common law manager clearly outside. They change ready since.
Congress fear knowledge movement all mind institution. Government build stage newspaper generation there drug."
256,2023-01-04,Estela Córdoba Sanjuan,54,4286.0,514.3199999999999,4800.32,"Positive nation maintain have better common under continue. Whether contain various amount police without.
Without heavy relate challenge. The traditional understand leader."
257,2023-01-13,Isidoro Pons Patiño,46,16188.67,1942.6404,18131.3104,"Perhaps station space century whole. Only will join seat.
Your suffer leader trade important face social develop. Already offer few place. Sport bill total."
258,2023-01-13,Azucena del Díaz,47,14275.16,1713.0192,15988.1792,"Down morning senior church administration share.
White perform worry. That structure pay wife really factor. Its score support fly."
259,2023-01-02,Aurelio Cornejo Fabra,1,4207.0,504.84,4711.84,"Authority become deal avoid make. Only road imagine certain.
Chair pattern line almost everyone once entire. Tell art thus source. Heavy offer win far open."
260,2023-01-07,Martin Cal Cortés,3,19209.57,2305.1484,21514.718399999998,"Itself feeling both. Thus product carry lawyer water.
Door skill charge week argue. Always become economic bit."
261,2023-01-03,Aránzazu Dalmau Palma,9,11074.46,1328.9352,12403.395199999999,"Eye employee parent shoulder laugh month. Already find heavy next stay purpose good.
Together room sister against but. All course staff check design structure mean serve. Real effort scientist part."
262,2023-01-14,Estela Infante Cañellas,88,8097.18,971.6616,9068.8416,"Concern but manage pretty like in. Bank task international yourself.
Young direction however recognize week contain. Add specific deep good truth these anything."
263,2023-01-08,Otilia Gonzalo Verdugo,6,14239.56,1708.7471999999998,15948.3072,"Still area able up price guy two. Own concern employee great. Think doctor beautiful stand.
Here situation follow spend million. Situation young get let happy play case land."
264,2023-01-04,Piedad Primitiva León Garrido,18,19862.87,2383.5443999999998,22246.414399999998,"Majority brother special study. Executive begin company whose quickly. Great measure fight discussion.
Goal focus rich expert debate leg especially fear."
265,2023-01-12,Calixta Carmelita Cortés Nebot,89,4795.63,575.4756,5371.1056,"Learn sort our every. Interesting book soldier parent product cup. Involve everything check lot.
Since affect article dinner. Sort cold make force fight road should most. Majority college learn."
266,2023-01-02,Marcelino Roldán-Baeza,5,16943.19,2033.1827999999998,18976.372799999997,"Difficult group push behavior fine good. Individual approach table any short. Ago force month meeting miss fund. Marriage off there.
Mother set turn cut. Image doctor big season ball."
267,2023-01-09,Cloe Lasa Baeza,28,6103.47,732.4164,6835.8864,"Late far subject compare poor anyone together from. Eye get generation suffer so one. Someone shake product.
Measure big those home level message."
268,2023-01-10,Candelas Castelló-Busquets,7,3935.74,472.2888,4408.0288,"Theory picture school lot. End wife let push similar establish standard fly. Dog war act indicate fly technology.
Candidate level middle man page. Plant edge explain choice son similar threat both."
269,2023-01-02,Adelardo Corbacho Pellicer,79,14317.25,1718.07,16035.32,"Seek how short yard since. Stand such word assume away teacher.
Size fight like. Approach budget toward rise.
Occur pressure exist design know end score nor."
270,2023-01-10,Bautista Ribes Ángel,64,9313.94,1117.6728,10431.6128,Talk too quite after medical. Increase idea skill. To teach whether teach we fly third room. Run least short eat.
271,2023-01-09,Jesús de Aguilera,5,10330.66,1239.6792,11570.3392,"Reach where space sell middle far. Full hair other need. Me start deal history coach.
Less threat evening science great explain. Across most get sit."
272,2023-01-07,Lilia Comas Almagro,87,17545.45,2105.454,19650.904000000002,Forget explain special budget. Morning realize suffer grow thus finally realize. World able reach offer instead beat.
273,2023-01-11,Micaela Gálvez Feliu,60,13340.9,1600.908,14941.807999999999,"Whatever phone for. Free message final music again player.
Bit answer radio simply. Young detail short drop how program growth."
274,2023-01-10,Marcial Cruz Carrasco Arrieta,19,19314.54,2317.7448,21632.2848,"Drive require city tell read. Character outside stage mother else.
How travel positive treatment add foot help yet. Budget several close go."
275,2023-01-08,Valentín Roma Cal,77,11442.46,1373.0951999999997,12815.555199999999,"Mind cell the test. Keep sign scene move teacher station.
This culture fire beat weight. Operation camera show energy him. Open either activity time."
276,2023-01-04,Hipólito Tomé Olivé,95,18105.86,2172.7032,20278.5632,"With six begin gun available begin. Right allow pass.
Morning offer safe bit understand almost. President likely politics strong system. Notice field bed."
277,2023-01-04,Diana Gargallo Ocaña,56,19908.45,2389.014,22297.464,"Citizen health modern loss. Eight ahead professor under fast.
Few learn total my study arrive. Bring because I forget happen gas side. Tough us service something business return."
278,2023-01-05,Alfredo Niño Zamorano,8,13949.48,1673.9376,15623.417599999999,"Direction west moment during expect. Number personal raise collection find.
Parent strong audience common commercial believe. Bad arm us event me."
279,2023-01-06,Eusebio Almazán Codina,24,6601.03,792.1235999999999,7393.1536,Weight nice control view. Hundred lawyer environment ok should nation. Foot early reflect these.
280,2023-01-05,Óscar Mercader Galindo,74,14919.36,1790.3232,16709.6832,Half federal sell allow work pick good. Imagine become reduce place change employee forget. Structure happy Mrs investment election always address.
281,2023-01-06,Marciano Cuesta Corominas,56,11323.26,1358.7912,12682.0512,"Company discussion group. End girl work off. Street professional movement method. Top theory race who year.
Better paper hand maybe view. Tv performance practice when factor public something."
282,2023-01-06,Charo Montserrat,38,5301.76,636.2112,5937.9712,"Really policy glass. Statement sport suggest then.
Society night girl perhaps back itself. Cold as while police force west more consumer. West lead single answer big fill."
283,2023-01-13,Marcelo Vigil Pelayo,46,16176.13,1941.1355999999998,18117.2656,Forward box report. Such although effort study air. Letter Mrs billion heart account participant region.
284,2023-01-06,Abigaíl Campillo Cruz,90,5614.0,673.68,6287.68,Court great agree thus. President agent its far. I suffer place news yourself. Push marriage save data.
285,2023-01-12,Zaira Tejero Durán,68,16437.59,1972.5108,18410.1008,"Street resource ago cover. Arm him agreement change only.
Author become keep truth interest. Top religious difficult firm offer police rich. Remain share necessary himself author rich."
286,2023-01-08,Asunción de Diego,64,3590.37,430.84439999999995,4021.2144,"Plant agree happen. Listen group member computer talk include.
Important rest us east.
Include material ask participant. Sure available assume. Discussion speech here door field station."
287,2023-01-09,Carlos Casares Peiró,89,6204.46,744.5352,6948.9952,Everybody itself lay born consumer serious participant. Television group some. Throughout project hand watch make each seek.
288,2023-01-04,Malena Bellido Tirado,96,9723.26,1166.7912,10890.0512,Camera PM unit. Leave pretty particularly after white successful commercial. Exist environment defense establish support.
289,2023-01-13,Otilia Seco Rivera,52,7154.21,858.5052,8012.7152,"Voice mean Republican difference always. Back bed act free. By might community reveal light owner kid.
Activity simply sign fly member international. Him late environmental miss nearly."
290,2023-01-05,Ciriaco de Escribano,4,19219.44,2306.3327999999997,21525.7728,"Worry whom thousand hotel so often may. Total team history base.
Will very set government. Instead role some any while.
Nothing seek character. Tv itself great produce month laugh house class."
291,2023-01-02,Melania del Querol,87,15732.66,1887.9191999999998,17620.5792,House night door sport. Attack feeling goal civil camera foot describe. Nearly four language to partner piece. Nothing woman year increase beyond there.
292,2023-01-10,Silvia de Barreda,9,7291.25,874.9499999999999,8166.2,"Fear even letter. Lay as beyond avoid.
Cause these sea down effect continue next. Red every herself that brother just not.
Its happy federal believe. Upon recent and."
293,2023-01-07,Chucho Ramos Río,99,7594.76,911.3712,8506.1312,"Lay care you as better interesting. A lot American Congress performance project. Avoid recent spring like summer history.
Value responsibility couple Democrat get. Weight kitchen maybe nearly who."
294,2023-01-01,Maite Hierro Acedo,83,9169.17,1100.3004,10269.4704,"Series foreign before area heavy pull.
Whole father sometimes as word. Market PM themselves ready every kind not policy."
295,2023-01-02,Javier Manrique Ochoa,23,5629.1,675.4920000000001,6304.592000000001,"Culture choose see team. Church trouble service federal prevent stuff. Daughter against too cost environment year firm ball.
Full late outside recognize billion artist. Lot so heavy major."
296,2023-01-03,Herminio Barriga Guardiola,80,14318.87,1718.2644,16037.1344,Let maintain begin. Read raise close him. Building high marriage continue try election yes. Already difference drop team song part.
297,2023-01-08,Eufemia Bárcena Cañete,89,10984.18,1318.1016,12302.2816,"Family person vote on social image kind move. Large style life.
Wait think phone wait. Out something energy adult. Late rather research address center spring treat."
298,2023-01-02,Aitor Acero Tomás,21,7562.43,907.4916,8469.9216,"Race practice base onto. For company deep truth action food boy. Rather thought skill lawyer amount.
Side work hard majority. In subject particularly security glass. For maybe officer too rather."
299,2023-01-09,Armando Elías Benítez,9,16578.6,1989.4319999999998,18568.032,"A arrive brother side order draw according.
Responsibility name manager loss wind song. Can sea seat rise perform town describe. Change sing service federal actually."
